<?xml version="1.0" encoding="UTF-8"?>
<!DOCTYPE sistemaSolar SYSTEM "PlanetasDelSistemaSolar.dtd">

<sistemaSolar>
    <Planeta nombre="Mercurio" habitable="no" color="naranja">
        Priemer planeta
        <Atmosfera>
            oxígeno (42 %), sodio (29 %), hidrógeno (22 %), helio (6 %) y gases traza.
        </Atmosfera>
        <Satelites nombre="ni" planeta="Mercurio">
            No hay satelites
        </Satelites>
    </Planeta>
    <Planeta nombre="Venus" color="rojo" habitable="no">
        <Satelites nombre="no" planeta="Venus">No hay</Satelites>
        <Atmosfera>
            Peligrosa
        </Atmosfera>
        El planeta recibe el nombre debido a la diosa Romana del amor
    </Planeta>
    
    <Astros>
        <meteorito />
        <nebulosa>Grande</nebulosa>
    </Astros>
</sistemaSolar>